title,score,id,comms_num,created,body,timestamp
"Den mægtige Kong Frederik IX, skræmmer svensken hans overlegene danske krop, udformet, og prydet med tatoveringer, i den stolte danske flåde.",68,2fxxjq,3,1410324719.0,,2014-09-10 06:51:59
SVENSKENS ANSIGT NÅR DE INDSER AT DE IKKE KAN FØLGE MED!,72,1vgjwi,0,1390008599.0,,2014-01-18 02:29:59
Kong Vom d. 1. af DANMAG,70,1hux9t,2,1373313284.0,,2013-07-08 21:54:44
DEN DANSKE NATIONALDESSERT SOM INGEN ANDRE LANDE KAN UDTALE,70,1hcyfd,6,1372617677.0,,2013-06-30 20:41:17
FÆLDER EN ENKELT TÅRE NÅR JEG SER DISSE KNEJSENDE DANSKE STOLTHEDER,69,1bv4ux,1,1365387996.0,,2013-04-08 04:26:36
De kongelige gravhunde nyder sommeren på Marselisborg Slot,71,4r93ui,2,1467692887.0,,2016-07-05 06:28:07
Snoop Dogg frastødt af Svensken og tager aldrig tilbage.,69,3eoek2,4,1437961080.0,,2015-07-27 03:38:00
"DANSK MATEMATIKGENI PÅ VEJ TIL VM I PROGRAMMERING: ""Vi er nok hurtigere end gennemsnittet af programmører, men et ambitiøst mål er at komme i top 12. Og hvis vi slår svenskerne, bliver vi glade,"" siger han.",70,35xo4h,4,1431631457.0,,2015-05-14 21:24:17
Den alvidende Niels Bohr sætter Einstein på plads!,68,2veodi,12,1423595659.0,,2015-02-10 20:14:19
Kætteri ved højlys dag!,67,2pyyn5,10,1419196719.0,,2014-12-21 22:18:39
DANMAG SPROGENES MESTER! SVENSKEN KAN KUN SØLLE TO SPROG,70,2ih22c,23,1412650303.0,,2014-10-07 04:51:43
MENS BRONZEALDERMANDEN BYGGEDE GRAVHØJE HERHJEMME BOLLEDE SVENSKEN MED SINE HESTE. OVERRASKET? NEJ.,68,24j3zy,2,1399052816.0,,2014-05-02 19:46:56
Århundredets største vittighed!,71,1vorsv,6,1390270217.0,,2014-01-21 03:10:17
SÅ DER LAGKAG'!,68,1s9v8m,4,1386396406.0,,2013-12-07 07:06:46
En hel palle med dansk stolthed!,66,1c80f2,4,1365820719.0,,2013-04-13 04:38:39
Lad svensken angribe! Carl er klar!,67,1c70v3,1,1365781978.0,,2013-04-12 17:52:58
1805 - Never forget...,68,1bztgw,7,1365551115.0,,2013-04-10 01:45:15
Endnu en uoriginal kantet migmig,65,846a7y,2,1520993167.0,,2018-03-14 03:06:07
Snart...,68,6h7ybj,1,1497480459.0,,2017-06-15 00:47:39
"Danskerne ligger på anden-pladsen over videnskabelige udgivelser per tusinde indbyggere, svensken er slet ikke til at finde (fjerdepladsen). (x-post fra /r/dataisbeautiful)",70,663pe9,0,1492559853.0,,2017-04-19 01:57:33
"Idag, på Förintelsens minnesdag, vill jag höja ett glas till er danskjävlar och tacka för ett välfärdsligt samarbete",67,5qj7vd,1,1485575086.0,,2017-01-28 04:44:46
Dansken hyldet som det mindt korrupte land mens svensken må flyde i korruption!,69,5q3exm,5,1485382931.0,,2017-01-25 23:22:11
Svensken anerkender sin underlegenhed – opfordrer svenskere til at flytte til Danmark,65,5efzp4,5,1479913279.0,,2016-11-23 16:01:19
TITEL I CAPSLOCK! PROBLEMET MED GRÆNSEKONTROLLEN TIL ØRESUND ENDELIG LØST!,67,54n2z3,12,1474954644.0,,2016-09-27 07:37:24
Københavnsk gadekunst hitter på forsiden! Svenskens fingermaling er ingen steder at se!,72,4x2dlo,0,1470868056.0,,2016-08-11 00:27:36
De stolte Danskere har invaderet Svensken!,65,4dlctk,0,1459971415.0,,2016-04-06 21:36:55
Dages frokost,67,48y6ap,13,1457139641.0,,2016-03-05 02:00:41
Smukkeste golf bane jeg nogensinde har set.,68,3hu1ut,4,1440183123.0,,2015-08-21 20:52:03
"Norge tager æren for dansk film skat, Olsen Banden.",65,3c6dqz,15,1436108469.0,"Jeg ser ofte nordmænd hoppe ind og spydigt dog arrogant påstå at Olsen Banden er norsk og at Danmark efterligner dem.
Aldrig har de taget 2 minutter for at kigge på wikipedia for at se hvornår hvilke film blev udgivet, eller hvor platte og manglende i sjæl, kvalitet og humor de norske forfalskninger var.


Selv tyskerne ved at Olsen Banden er dansk, og det blev hyldet tilbage i sin tid men blot en tysk synkronisering (som de gør med alt ha-ha-haaaa)

Hvad fanden i hele hule helvede fejler de arrogante fjellaber? Har de virkelig drukket så meget olie at de er blevet skøre, eller er det bare deres urimelige dyre pris på spegepølse der får dem til at skabe illusioner for at overkommer hvor sølle en primitiv lille pis skvat nation af en flok klasseklovne de i virkeligheden er? Aldrig har jeg set mage, det her er ikke nogen cirkeljerk, der er ingen, siger jeg jer, ingen der overhovedet skal tænke på at flå skatten, Olsen Banden, ud af hænderne på verdens bedste og ældste nation, og slet ikke sådan et par prettyboys hvis største kontribution til verdenen er ostehøvlen. Fy for helvede sådan et par amatører, mælk skal drikkes, ikke spises!

**TL;DR: Norge pisser på Ove Sprogøe og sniffer til sine egne prutter fordi de er blevet relevante efter oliefund**

Obligatorisk Egon Olsen Rant: https://www.youtube.com/watch?v=x91CfIxBHB0 ",2015-07-05 17:01:09
Gud Bevare Danmark - Dronning Margrethe den 2. giver 0 fucks,68,2uib3w,12,1422906204.0,,2015-02-02 20:43:24
Hvornår starter invasionen af /r/inglin?,67,1vxauf,50,1390488106.0,,2014-01-23 15:41:46
DANMARK VINDER ESC PÅ SVENSKENS HJEMMEBANE!,68,1ell4w,2,1368944586.0,,2013-05-19 08:23:06
Vi er rigere end svensken!,67,5d4p97,15,1479269065.0,,2016-11-16 05:04:25
Hvilket land er mon det dårligste i norden? (Hint: det har ikke vundet OL guld i håndbold i Rio),69,4zce2r,3,1472071673.0,,2016-08-24 22:47:53
