title,score,id,comms_num,created,body,timestamp
"De store studier kæmper om den stolte Daner, Mads Mikkelsen. Svensken er ikke til at finde! [X-post /r/marvelstudios]",96,5etevd,8,1480106905.0,,2016-11-25 21:48:25
Der er vidst en som skal have inddraget sit statsborgerskab,100,5azeta,4,1478235833.0,,2016-11-04 06:03:53
Vores stolthed (x-post r/funny),99,4dpzg2,8,1460041881.0,,2016-04-07 17:11:21
DE STOLTE DANER GLEMMER IKKE!,94,420lmh,10,1453421001.0,,2016-01-22 01:03:21
VEJRET KNÆLER FOR HKH FREDERIK,98,2s5t3a,10,1421096631.0,,2015-01-12 22:03:51
Dansk Folkepartis nuværende situation,95,9h7c5f,12,1537407997.0,,2018-09-20 03:46:37
Georg skal vaskes,95,7js0f4,0,1513291677.0,,2017-12-14 23:47:57
Skive Memeblad,95,758o6x,0,1507580203.0,,2017-10-09 22:16:43
Mig rn,96,6wzsjy,6,1504134895.0,,2017-08-31 01:14:55
Danmark igen de bedste i skål! (Skål!) Svensken ingen steder at se.,97,5ygr0k,10,1489112704.0,,2017-03-10 03:25:04
"Min reaktion på Ruslands ynkelige ""trussel"".",96,2zwgtx,16,1427059828.0,,2015-03-22 22:30:28
EN ÆGTE DANER!,95,1f2r1p,10,1369592673.0,,2013-05-26 20:24:33
Skåne og Schleswig-Holsten burde være vore,96,9rdgfo,11,1540524554.0,,2018-10-26 05:29:14
/r/DANMAG er hårdtarbejdende! Hvor er /r/SWARJE??!,95,54psbk,1,1474997331.0,,2016-09-27 19:28:51
Jeg fandt svensken!,93,4ywdsw,2,1471833976.0,,2016-08-22 04:46:16
"Ud af alle nationer på jorden, hvilken er mest sandsynlig ikke at eksistere i 2050?",96,4ig8s7,10,1462768646.0,,2016-05-09 06:37:26
Britterne har stadig ikke gennemskuet vort hemmelige våben!,98,3odk90,11,1444628094.0,,2015-10-12 07:34:54
Dansk stolthed (mælk for størrelsesforhold),94,3alxy4,7,1434927374.0,,2015-06-22 00:56:14
Erkennt schon mal euren neuen Herrscher an,94,2vcqrz,4,1423551936.0,,2015-02-10 08:05:36
"DANMARK NR.2 PÅ HUFFINGTON POSTS ""MUST SEE BEFORE YOU DIE""-LIST - SVENSKEN FULDKOMMEN UDE AF SIGTE!",98,25v8ff,10,1400456335.0,,2014-05-19 01:38:55
Verden erkender danskens overlegenhed (x-post from r/standupshots),97,1vfod5,2,1389976913.0,,2014-01-17 17:41:53
DANMARK SEJRER IGEN! LÆR DET SWARJE!,92,1ell0w,5,1368944488.0,MELODIGRANDPRIX ER VORES! VI ÆRER BRØDRENE OLSEN!,2013-05-19 08:21:28
Når der er Dansk post på forsiden,98,1d2pv8,2,1366915147.0,,2013-04-25 20:39:07
Svensken trenger hjælp!,94,2soqym,4,1421483387.0,,2015-01-17 09:29:47
MARGRETHE II VS. CARL XVI GUSTAF (NSFS -Not Safe For Svensken),93,1uydjd,1,1389468613.0,,2014-01-11 20:30:13
Jeg så premieren på sæson 9 af HIMYM her til morgen. Pludselig skete der noget uventet og meget smukt i baggrunden.,91,1n3hye,14,1380137796.0,,2013-09-25 21:36:36
NED MED SVENSKEN! (Legomand angriber IKEA med røde pølser og tuborg i et patriotisk terror angreb),95,1lkgrh,7,1378142189.0,,2013-09-02 19:16:29
"DE DANSKE TROPPER MARCHERER GENNEM SKÅNE, EFTER BEFRIELSEN AF DETS SVENSKE UNDERTRYKKERE",93,1c4czj,4,1365690689.0,,2013-04-11 16:31:29
Swärje og Nårje er ikke pæne at se på,92,1c2cw9,8,1365634143.0,,2013-04-11 00:49:03
Stockholm er ok!,94,5qn8wt,4,1485633130.0,,2017-01-28 20:52:10
Svensk Glögg,96,5gzl26,7,1481142086.0,,2016-12-07 21:21:26
"En sød hund, men så alligevel ikke",91,4dvncz,3,1460136237.0,,2016-04-08 19:23:57
Danmark er endnu engang på forsiden OG SVENSKEN ER INTET STED AT SE,93,1sk4fg,5,1386724121.0,,2013-12-11 02:08:41
smukt syn hver gang ved den dansk tyske grænse [REPARERET],96,1iykx0,8,1374708182.0,,2013-07-25 01:23:02
Dansken viser endnu engang verden hvordan man skal skyde n00bs i Counterstrike. Svensken på en sølle sidsteplads (hvor de hører til!),92,8kw8d2,0,1526885374.0,,2018-05-21 08:49:34
KNÆL FOR KONG CHRISTIAN! Eriksen-hattrick sikrer VM-billetten,93,7cza63,3,1510726396.0,,2017-11-15 07:13:16
"Danmark er endnu engang i South Park, men hvor er svensken?",91,55166w,14,1475165447.0,,2016-09-29 18:10:47
Deutschland,93,2vjt3l,2,1423701648.0,,2015-02-12 01:40:48
"While the krauts of /r/SCHLAND have been attacking /r/DANMAG, the krauts at /r/kreiswichs have been at war with us in /r/cirkeltrek. LET THEM FIGHT ON TWO FRONTS!",88,2vf8nh,16,1423610277.0,,2015-02-11 00:17:57
Wallpaper til /R/DANMAG!,92,1y507m,11,1392664329.0,,2014-02-17 20:12:09
HVA SATAN???!!!,92,7j4mwz,3,1513049881.0,,2017-12-12 04:38:01
"Svensken fører sig frem foran amerikaneren, mens vi ikke engang skal have pungen frem",91,7hhzfz,14,1512429956.0,,2017-12-05 00:25:56
Når svensken skal være fuld,90,5mzcdm,4,1484015233.0,,2017-01-10 03:27:13
"Karl Otto Meyer er død, 87 år gammel. Han viede sit liv til at kæmpe for fædrelandet i Sydslesvig, og hans største drøm var at se et Danmark til Ejderen. Han er den slags dansker, vi alle skal stræbe efter at være. Æret være hans minde.",91,44qqsh,10,1454964298.0,,2016-02-08 21:44:58
True advertising,89,2ysknr,9,1426196873.0,,2015-03-12 22:47:53
Havde en mindre uoverensstemmelse på FB igår. Tak for grafisk hjælp! Hurra!,93,2y5hs7,10,1425690772.0,,2015-03-07 02:12:52
Dannebrogs sang,91,2ornjz,10,1418172188.0,,2014-12-10 01:43:08
Så herskerligt smukt :'),92,1te9j0,4,1387664704.0,,2013-12-21 23:25:04
Batman,95,1kzx93,18,1377369359.0,,2013-08-24 20:35:59
SØREN KIRKEGAARD PÅ GOOGLE SLÅ DEN SVENSKERE,91,1dq2mw,4,1367770859.0,,2013-05-05 18:20:59
BS og Bubber vogter mod ABBA bøsser der prøver at krydse Øresund.,92,1c73z1,0,1365788108.0,,2013-04-12 19:35:08
En mavepuster til de djævelske svenskere,89,8d052f,4,1524028601.0,,2018-04-18 07:16:41
Frank Hvam medvirker i Game of Thrones,91,4q2e9n,25,1467046085.0,,2016-06-27 18:48:05
"I år har Danmark valgt at holde sig fra EM for at give de andre en chance. Og svensken? Tja, staklerne gør deres bedste.",86,4nhn1n,4,1465611238.0,,2016-06-11 04:13:58
Bernie Sanders is right: Denmark is the best nation for working people,88,46uo9c,3,1456077003.0,,2016-02-21 18:50:03
"GLEDELIG JUL, KJÆRE DANSKER!",91,3y4wa5,3,1451032920.0,"Gledelig jul, pølser! 

Vit at vi nordmenn er glade i dere! (jer) <3

Edit: Nordmenn er aldri 24 timer for sene; vi kommer nøyaktig når det passer oss!",2015-12-25 09:42:00
"HIP HIP HURRA, DET ER DRONNINGENS 75-ÅRS FØDSELSDAG!",92,32s2hy,18,1429195636.0,ALLE MED I STIKBOLD IGEN,2015-04-16 16:47:16
R.I.P. Allan Simonsen,91,1gv09b,3,1371947046.0,,2013-06-23 02:24:06
DET DANSKE FOLKS MORALSKE KAMPVOGN,90,1bzt8e,4,1365550930.0,,2013-04-10 01:42:10
Den eneste tid på året hvor norsken er din ven,91,7dvdnx,2,1511064501.0,,2017-11-19 05:08:21
When you search for 'Swedish Flag' on Google Images!,91,5buj29,2,1478654443.0,,2016-11-09 02:20:43
Hvorfor vi burde stemme på Sverige i aften til Eurovision...,88,36zl0p,8,1432418095.0,"SÅ VI KAN VINDE PÅ SVENSK GRUND FOR **3. GANG** NÆSTE ÅR OG UDMYGE DE FORBANDEDE SVENSKERE FORAN HELE EUROPA!!!1!!1!



##2000 & 2013 -**NEVER FORGET**



EDIT: **VI SES NÆSTE ÅR /R/SWARJE**",2015-05-23 23:54:55
Fra DRs afstemning om de største øjeblikke på TV,88,2yovr6,12,1426119548.0,,2015-03-12 01:19:08
Hvordan /r/SWARJE ser dem selv,90,1cv877,1,1366672846.0,,2013-04-23 01:20:46
Dansk stolthed til masserne!,89,1c74tl,1,1365789834.0,,2013-04-12 20:03:54
Jeg kan ikke se noget svensk flag,88,1c72jz,7,1365785329.0,,2013-04-12 18:48:49
Holger Danske gør sit indtog i spillet For Honor,90,5u3933,5,1487137512.0,,2017-02-15 06:45:12
PAS PÅ! DEN DANSKE FLÅDE KOMMER!,86,3h4xux,2,1439703383.0,,2015-08-16 07:36:23
"Amen krille, amen!",89,3gp3gw,10,1439392639.0,,2015-08-12 17:17:19
Hvad skal jeg gøre nu?!,89,2tb9yq,11,1421980324.0,,2015-01-23 03:32:04
Stolt dansker!,91,2psynv,3,1419039062.0,,2014-12-20 02:31:02
ÆGTE DANSKE EM-SNITTER,89,1w0z7e,3,1390593553.0,,2014-01-24 20:59:13
Sveriges justitsminister kan ikke engang genkende simpel satire.,86,1um9he,10,1389123674.0,,2014-01-07 20:41:14
DET ÄR OK DANMAG VI ÄR INTE ARGA,87,1c5rpb,4,1365742314.0,,2013-04-12 06:51:54
MRN Jeg ser en svensker på et dansk subreddit,85,4165yf,12,1452935839.0,,2016-01-16 10:17:19
DANSKERN ER I RUMMET NU! MEN HVOR ER SVENSKERNE,88,3jbe8k,9,1441197647.0,,2015-09-02 14:40:47
SVERIGE YES!,89,2ow1ia,12,1418266772.0,,2014-12-11 03:59:32
SE! EN ÆGTE VIKING PÅ FIRE HJUL!,85,20js0w,3,1395004603.0,,2014-03-16 22:16:43
"280 KG DANSK, ELDREVET INGENIØRKUNST",89,1emhqy,11,1368986306.0,,2013-05-19 19:58:26
Svensken: Internationalt anerkendt som små og svage,83,60i6gy,0,1490062600.0,,2017-03-21 03:16:40
Dansken dominerer Oscars. Svensken kan ikke andet end filmatiseringer af Astrid Lindgren!,86,5rup9j,1,1486166430.0,,2017-02-04 01:00:30
Jag lagade stekfläsk med persiljesås idag.,88,3uww8k,6,1448950766.0,Det var allt jag ville säga.,2015-12-01 07:19:26
Jeg føler mig... forkert,84,3ljoya,55,1442690874.0,,2015-09-19 21:27:54
Jeg jagtede ham i godt tre minutter,89,3dmsdh,7,1437175196.0,,2015-07-18 01:19:56
"Jylland, tydeligvis... http://bit.ly/1Jql4Vp",88,351ppc,16,1430940150.0,,2015-05-06 21:22:30
De stærke midler skal tages i brug for at knække tysken. Bøfsandwich!,87,2veay7,0,1423582504.0,,2015-02-10 16:35:04
Grunden til at svensken ikke har været i krig i 200 år. De kan ikke finde ud af det.,83,2e9e9d,4,1408723871.0,,2014-08-22 18:11:11
Danske spiludviklere hitter på Steam,87,1p5goc,4,1382679799.0,,2013-10-25 07:43:19
Plague Inc. udviklere taget i majestætsfornærmelse af Kongeriget Danmark!,87,5v3ft2,14,1487607200.0,,2017-02-20 17:13:20
Djævlens værktøj,81,4dwuew,14,1460157457.0,,2016-04-09 01:17:37
Fresh Prince of DenMark [fra FB],86,355lce,5,1431015765.0,,2015-05-07 18:22:45
DEN DANSKE INVASION AF /R/SHITTYAMA. VIKINGERNE SEJRER OVER DE AFSKYLIGE MODS,85,1vo1qv,3,1390250237.0,,2014-01-20 21:37:17
GICK JU BRA FÖRRA GÅNGEN NI VILLE HA SKÅNE,89,1c3962,3,1365657541.0,,2013-04-11 07:19:01
INGEN OVERGÅR DET DANSKE KØKKEN!,85,1bzkgk,8,1365543042.0,,2013-04-09 23:30:42
Svensken er ifølge objektive og officielle kilder udnævnt til at være det absolut værste nordiske land at bo i.,81,77f55n,2,1508455912.0,,2017-10-20 01:31:52
Landsforræderi af værste skuffe i Politiken!!!!,83,3q4xp9,6,1445799026.0,,2015-10-25 19:50:26
Min bil i Rocket League,84,3cxc5g,5,1436661807.0,,2015-07-12 02:43:27
Svensken er intet.,82,2vnccq,5,1423775423.0,,2015-02-12 22:10:23
Vikings are always first (x-post from /r/funny),86,2rfx8c,0,1420522618.0,,2015-01-06 06:36:58
GUD BEVARE /DANMAG!,84,1u472r,5,1388552577.0,,2014-01-01 06:02:57
En af os!,82,1d3bdd,5,1366936752.0,,2013-04-26 02:39:12
"Svensken har en fantastisk ting, som Danmark ikke har!",83,6902dn,3,1493843856.0,En prangende havudsigt til et smukt naboland! ,2017-05-03 22:37:36
Set på /r/imgoingtohellforthis,82,4gyhl8,9,1461947012.0,,2016-04-29 18:23:32
"Svensken ved ikke hvordan man laver musik, er nødt til at høre på dansken",85,3plpdb,4,1445438441.0,,2015-10-21 16:40:41
Den ægte vare,83,3k8lr5,7,1441833463.0,,2015-09-09 23:17:43
"Hallo Denemarken mogen wij uw fietsnetwerk? Als het niet goedschiks kan, dan moeten we helaas uw subreddit overnemen. Vriendelijke groet, Steelpan.",86,36gzoq,59,1432055600.0,,2015-05-19 19:13:20
Saw this Danish island while walking home today. Such a shame it's not Canadian.,85,2qqoog,5,1419912593.0,,2014-12-30 05:09:53
Jeg skammer mig over landsforrædere som denne,86,2j8t71,5,1413343560.0,,2014-10-15 05:26:00
Alt er gladere i Danmag,82,2cwhsn,3,1407462180.0,,2014-08-08 03:43:00
LÆNGE LEVE MILEY CYRUS!!!,82,27hkmw,4,1402106814.0,,2014-06-07 04:06:54
Vores allesammens General mod Norge!,81,25tbpk,0,1400387065.0,,2014-05-18 06:24:25
Eurovision,82,258f1y,8,1399784729.0,Jag måste erkänna att ni har gjort det bra. Ni har tänkt på allt.,2014-05-11 07:05:29
DANMAG SOM DET FØRSTE LAND I MINECRAFT 1:1!,85,23ugsx,8,1398359642.0,,2014-04-24 19:14:02
De engelske barbarerer er her! Røde Pølser til forsvaret!,82,1w3va7,0,1390672961.0,,2014-01-25 19:02:41
Velfærdsdrik!,82,1vo1zu,3,1390250550.0,,2014-01-20 21:42:30
Jeg bager patriot mad til den forestående invasion af Swarje,80,1ekvn3,15,1368919714.0,,2013-05-19 01:28:34
Jeg tror måske svenskerne har undervurderet hvad de har sat igang,81,1c7k79,1,1365808414.0,,2013-04-13 01:13:34
DANMARK ER I EM FINALEN! HVOR ER SVENSKEN?,81,6rir9x,11,1501857962.0,,2017-08-04 16:46:02
Igen gør Mads Mikkelsen Danmark ære!! Svensken kan ikke en gang få en statistrolle i lokalteatret!!,80,5g227r,12,1480692741.0,,2016-12-02 16:32:21
MRN min lillebror spørger mig om jeg kan lide hans nye svenske kæreste,84,4evlkl,6,1460733030.0,,2016-04-15 17:10:30
Svensken er ved at bryde sammen af korruption,79,2tttkq,10,1422382883.0,,2015-01-27 19:21:23
Ærlig snak på internettet.,79,2r83g5,5,1420340508.0,,2015-01-04 04:01:48
[TUNG VEJRTRÆKNING],82,2eh7z7,21,1408947717.0,,2014-08-25 08:21:57
"HVILKET SMUKT SYN, PÅ EN SMUK DAG!",81,29tqmi,2,1404510147.0,,2014-07-04 23:42:27
Dansk vs. Norsk politik,81,1m67tj,14,1378932825.0,,2013-09-11 22:53:45
Danmarks stolthed!,82,1cmjpd,12,1366342648.0,,2013-04-19 05:37:28
"Sverige, hele Europa's penisjoke!",85,1c81xt,6,1365821871.0,,2013-04-13 04:57:51
ØRESUNDSBROEN VAR EN FEJL!,79,1c0e63,2,1365565872.0,,2013-04-10 05:51:12
Det allerbedste (album),82,6gny56,0,1497245222.0,,2017-06-12 07:27:02
Så... Skal vi kanskje bare ta å gå inn i en union eller noe sånt snart? Hvis det er ok for dere også da?...,82,5wa8mn,20,1488147054.0,"Vi tilbyr brunost og ""Skam"" som bonus...

[Ser de ikke fine ut sammen](http://bloggfiler.no/unioneen1814.blogg.no/images/1679546-9-1358976168975.jpg)?",2017-02-26 23:10:54
DE UNDERLEGNE SVENSKERE INDRØMMER DANERNES SUVERÆNITET,79,53j2q3,5,1474339231.0,,2016-09-20 04:40:31
Danmark er verdensmestre i Badminton!,82,4ki1qa,1,1463941819.0,,2016-05-22 20:30:19
HVOR ER DIN GUD NU SVERIGE?,82,2656yf,5,1400728659.0,,2014-05-22 05:17:39
AGTE DANSK VIKINGE TAGER BILLEDE AF LANDETS FREMTID,81,1onmbo,9,1382059131.0,,2013-10-18 03:18:51
"Selv de store subreddits har fundet sandheden nu, Danmark længe leve.",84,7npkue,4,1514957472.0,,2018-01-03 06:31:12
"åh nej, nu er svensken i gang igen. hævder at de er en ""succes"" og ""nordens konge"". 6000 upvotes. ser ud til at alle i sverige hjalp til den her gang. lad os vise dem hvem der bestemmer!",80,6u1ics,5,1502913188.0,,2017-08-16 21:53:08
Dannebrog - Det Første og Bedste Flag (Og Svensker stjal det),81,6fdxml,0,1496695470.0,,2017-06-05 22:44:30
En ordentlig omgang svensk cringe,83,5akcx9,4,1478049570.0,,2016-11-02 02:19:30
Danmag mindst korrupte land i verden. Svensken ligger på en bund korrupt tredjeplads!,80,42wub9,10,1453917905.0,,2016-01-27 19:05:05
9 grunde til at den danske økonomi efterlader USA's i støvet,81,3prm47,2,1445546738.0,,2015-10-22 22:45:38
Everything is awesome - havde lige en halvtimes klip & klistre overspringshandling,80,2xgfee,4,1425155191.0,,2015-02-28 21:26:31
"Schönes Auto min RØV - dette er et design, der sætter helt nye normer for nærtransport",80,2vmwlg,2,1423760337.0,,2015-02-12 17:58:57
SVENSKEN I SIN USLE STORHED,79,2jzdy9,17,1414005037.0,,2014-10-22 21:10:37
"Jeg er en mod på / r / shittyAMA og jeg ønskede at lade dig vide, i min Google Translate dansk, at vi har overgivet sig til din kontrol. Du kan stoppe med at lave IAMA Dane indlæg nu.",83,1vo68r,20,1390255234.0,Please.,2014-01-20 23:00:34
Vi drukner svensken i dansk lykke-juice!,83,1c7egw,6,1365803428.0,,2013-04-12 23:50:28
Danmarks ædle Rigsvåben (og svenskens til sammenligning),80,1c0g3c,3,1365567140.0,,2013-04-10 06:12:20
Det skotske sprog er smukt!,79,8fjq0d,3,1524949070.0,,2018-04-28 22:57:50
"""Ikke engang svenskerne kunne finde på sådan noget, og er der nogen, der er idioter, så er det svenskerne"" - Brian Holm",79,6of2ek,0,1500570263.0,,2017-07-20 19:04:23
Selv Svensken fatter ikke deres eget sprog!,79,4vs31g,8,1470168390.0,,2016-08-02 22:06:30
INVASIONEN ER BEGYNDT! VI SKAL GENSKABE DANELAGEN!,77,4nfp4q,6,1465583594.0,,2016-06-10 20:33:14
Man må vise Google vejen frem,77,452izw,7,1455137419.0,,2016-02-10 21:50:19
Svensken skyder med stormgevær,78,3w8spv,13,1449794973.0,,2015-12-11 01:49:33
NORDPOLEN BLIVER VORES!,81,2r7kno,19,1420329507.0,,2015-01-04 00:58:27
Lad os invadere sverige med denne bil,78,2nnppo,7,1417200237.0,,2014-11-28 19:43:57
I en fremtid langt væk... eksistere der kun Danskhed,79,1utpms,11,1389329583.0,,2014-01-10 05:53:03
Den forurenene svenske befolkning udleder tonsvis af CO2 på lange flyrejser - dansken holder verden ren!,77,7kvoer,7,1513741311.0,,2017-12-20 04:41:51
Når man elsker sit land ubetinget,81,6mt7ql,1,1499886284.0,,2017-07-12 21:04:44
Dannebrog!!!,78,6j9qg1,1,1498358215.0,,2017-06-25 04:36:55
Dansk skuespiller foreslås som Geralt på forsiden - IGEN er svensken ikke at ane!,79,450qww,2,1455104317.0,,2016-02-10 12:38:37
Verdens bedste låseskærm!,80,402qt9,9,1452311623.0,,2016-01-09 04:53:43
"Canada har gjort krav på /r/HansIsland, men de har forladt øen igen. Jeg har anmodet om at overtage den - for Gud, konge og fædreland.",80,3tf9en,11,1447963507.0,,2015-11-19 21:05:07
Jeg ville stemme på dem,77,3422dt,2,1430187581.0,,2015-04-28 04:19:41
Danmarks Radio ved det!,78,2p0a97,1,1418359185.0,,2014-12-12 05:39:45
Danmag må se sig slået af svenskeren I MEST KRIMINALITET,75,2ma98o,3,1416002830.0,,2014-11-14 23:07:10
Glædelig jul til hele /DANMAG!,81,1tm1lw,4,1387929973.0,,2013-12-25 01:06:13
Jeg lavede dette billede til min fysikrapport om vindmøller (Svane triller en glædeståre over ægte dansk design),78,1p7hcm,4,1382752683.0,,2013-10-26 03:58:03
250 GRAM SALTET DANSK STOLTHED,76,1bzpx7,9,1365548213.0,,2013-04-10 00:56:53
Prinsgemalen har brug for DIG,76,636mqb,8,1491253531.0,,2017-04-03 23:05:31
RØDE PØLSER,77,2zqxug,10,1426918534.0,"VIL BARE GERNE SIGE, AT JEG ELSKER RØDE PØLSER. DE SMAGER SGU FANDME GODT.",2015-03-21 07:15:34
Min dansklærer har givet mig noget smukt patriotisk materiale.,74,2n9498,5,1416854083.0,,2014-11-24 19:34:43
Respekteret dansk bryg med i Eminem musikvideo!,78,2gz448,7,1411271025.0,,2014-09-21 05:43:45
"I can't speak Danish, but I freaking love Denmark.",74,23h5sf,35,1397983307.0,Am I accepted here?,2014-04-20 10:41:47
"Öh, Silvia!",74,1x62xy,8,1391708406.0,,2014-02-06 18:40:06
Til alle dem som planlægger et angreb imod /r/DANMAG har jeg kun én ting at sige.,76,1wn1iu,7,1391199064.0,,2014-01-31 21:11:04
TV2 Play for alle!,78,1uauw7,43,1388768908.0,"3 måneders gratis TV2 Play!

1. Gå til link. http://play.tv2.dk/buy/pay?productid=2
2. Vælg “Kampagnekode” som betaling.
3. Indtast følgende “44576914234″.
4. Du har nu 3 måneders gratis TV2 Play Premium.
Dette tip gælder indtil d. 6. januar, 2014.",2014-01-03 18:08:28
"TILLYKKE TIL VOR ÆREDE OG OPHØJEDE MONARK, DRONNING MARGRETHE ALEXANDRINE ÞÓRHILDUR INGRID DEN ANDEN",76,1chfke,2,1366172552.0,,2013-04-17 06:22:32
"X-post: Mine Damer og Herrer: Tillad mig at præsentere - Søren Pape Poulsen, justitsminister i Danmark",75,5j2nhg,3,1482127329.0,,2016-12-19 07:02:09
STOLT DANSKER VINDER EM-GULD I HÆKKELØB!!! EKSISTERER SVENSKEN OVERHOVEDET MERE?,73,4s6eqn,1,1468200441.0,,2016-07-11 03:27:21
Dansk kultur under det hidtil hårdeste angreb,78,3rzw7t,7,1447011366.0,,2015-11-08 20:36:06
VERDENS ÆLDSTE NATIONALFLAG I RUMMET,76,3kkd7g,0,1442020803.0,,2015-09-12 03:20:03
MGW ich plötzlich im unterlegenen /r/Danmag lande,75,2vbigk,8,1423532541.0,,2015-02-10 02:42:21
EJER/PATRIOT SØGES: Denne Elite Købmand-pose fundet i Fælledparken fyldt med Olsenbanden-vhs'er. Findeløn kan afregnes i postkort med kongefamilien.,74,274phv,3,1401761806.0,,2014-06-03 04:16:46
TIL: Sverige er et tredjeverdensland,78,24urwl,7,1399402774.0,,2014-05-06 20:59:34
TOM K. GØR DET IGEN,77,1gwncs,9,1372021328.0,,2013-06-23 23:02:08
Rigtige Konger bekymrer sig om deres undersåtter.,80,1g4c8e,1,1370987478.0,,2013-06-11 23:51:18
DET DANSKE PRODUKT DER REVOLUTIONEREDE VERDEN,77,1bzlze,6,1365544632.0,,2013-04-09 23:57:12
Selv Spotify synes at Skåne er dansk!,77,5yt4wn,3,1489274780.0,,2017-03-12 00:26:20
Den ultimative bjergbestiger-bedrift,72,3q9pht,4,1445889008.0,,2015-10-26 20:50:08
2-trins guide til at forbedre vores elskede skandinavien!,74,34o1i0,27,1430636046.0,,2015-05-03 08:54:06
Glem aldrig! Evige nordiske mestre i pikkemand!,73,1l8136,6,1377674825.0,,2013-08-28 09:27:05
præcis hvor vi hører FORAN HELE VERDEN TIL SKUE OG MISUNDELSE,74,1f7x7v,7,1369800050.0,,2013-05-29 06:00:50
Danske smørkager er på forsiden! Men hvor er svensken?!,78,9uy7em,0,1541613985.0,,2018-11-07 19:06:25
DANMARK ER OVER SVENSKEN,75,8f9c7t,0,1524836431.0,,2018-04-27 15:40:31
MEN HVOR ER SVENSKEN?,76,7voqx6,6,1517965393.0,,2018-02-07 02:03:13
Svenskens fejhed er tydelig for alle.,74,72m7p5,0,1506478060.0,,2017-09-27 04:07:40
Fandt den her skønhed i Løsning brugsen,75,68fq84,5,1493591654.0,,2017-05-01 00:34:14
PERNILLE BLUME'S REAKTION TIL GULD NÅR FRONTPAGE! ÆRE TIL FÆDRELANDET!,76,4xnv8o,0,1471205661.0,,2016-08-14 22:14:21
Må vores tanker gå ud til vores kompagnoner i Frankrig,76,3sricb,1,1447520321.0,"En tragisk tid for Frankrig, men vi vil støtte dem.",2015-11-14 17:58:41
HENDES KONGELIGE HØJHED,74,3mqm2p,3,1443497933.0,,2015-09-29 05:38:53
*Danskhed Intensificerer*,74,399wfw,12,1433953980.0,,2015-06-10 18:33:00
NOGET ENHVER STOLT DANER KAN TILSLUTTE SIG!,75,34c44q,24,1430379090.0,,2015-04-30 09:31:30
DANMAG gør krav på Nordpolen!,71,2pccfl,10,1418659887.0,,2014-12-15 17:11:27
Danmark består! Svensken i undertal!,76,2mwpsm,12,1416543598.0,,2014-11-21 05:19:58
Giraf-gate 2014- Never forget!,76,1xpte2,4,1392250662.0,,2014-02-13 01:17:42
LÆNGE LEVE DANNEBROG,70,1pv5hf,2,1383581908.0,,2013-11-04 17:18:28
RIKKE MØLLER SÆTTER VERDENS REKORD I 200M BRYST!!!!!!ER SVENSKEN DRUKNET!?!?!?!,76,1jiby4,3,1375409202.0,,2013-08-02 04:06:42
"Det er i dag 616 år siden den retfærdige og uselviske Dronning Margrete I. fik knækket Svensken og dermed indtog sin retmæssige stilling, som Dronning af Norden. Må hendes navnesøster følge trop!",77,1gjel8,6,1371529955.0,,2013-06-18 06:32:35
ENDNU EN FANTASTISK DANSK OPFINDELSE!,77,1e4n8t,6,1368310978.0,,2013-05-12 00:22:58
En fuld svensker var den første til at snyde til OL. Det ku man ha sagt sig selv.,75,4z2vpi,1,1471929961.0,,2016-08-23 07:26:01
En stolt dansker forsvarer nationens ære,73,4qqccy,13,1467383558.0,,2016-07-01 16:32:38
DANSKER MED PÅ ET AF VERDENS STØRSTE TALKSHOWS. SVENSKEN INGEN STEDER AT SE,77,3wdt8o,2,1449875232.0,,2015-12-12 00:07:12
Hele verdenen undrer sig over svenskens underlige tøjstil. x-post /r/tumblr,73,3aooin,3,1434983461.0,,2015-06-22 16:31:01
VORES ALLE SAMMENS DOUCHEMARINE NEDLÆGGER SVENSKEN I WCS QUALIFIERS! (StarCraft 2),72,2sbipa,17,1421210265.0,,2015-01-14 05:37:45
"Godt nytår, brødre! Svensken fejrer det sikkert mærkeligt!",73,2qy6o7,1,1420086336.0,,2015-01-01 05:25:36
Danmark knuser svensken i verdensmesterskabet i Hearthstone og vejen til mesterskabet er nu lagt.,73,2hczmz,9,1411616867.0,,2014-09-25 05:47:47
DANMAG I THE TONIGHT SHOW!,71,24wcn9,7,1399440636.0,,2014-05-07 07:30:36
Jeg fandt dette i min samfundfagsbog og tænkte at jeg vil dele det med alle mine med-danskere!,73,24g6cg,11,1398974369.0,,2014-05-01 21:59:29
"Jeg føler, jeg har gjort min pligt",71,22b2uy,5,1396770366.0,,2014-04-06 09:46:06
DENMARKU STRONGU!,73,1znc1x,5,1394074818.0,,2014-03-06 04:00:18
Ægte patriot fundet på 4chan,75,1vupkz,10,1390430668.0,,2014-01-22 23:44:28
"Kneb en tåre for Fædrelandet, da jeg så denne reklame i Londons Undergrund i dag. Glorværdige Ø'er og Æ'er i kæmpeformat, lige op i ansigtet på de feje englændere!",75,1f78tm,4,1369780986.0,,2013-05-29 00:43:06
SEJR!,74,1ell1a,2,1368944492.0,,2013-05-19 08:21:32
PRØVER SVENSKEN OVERHOVEDET?,72,1c2a6q,10,1365631733.0,,2013-04-11 00:08:53
"DANMARK er det 5. mest fredelige land, sverige er på en krigsliderlig 18. plads!",71,6epinr,8,1496377475.0,,2017-06-02 06:24:35
Jeg har en dansk mus og en svensk mus. En af dem fungere ik' mere. GÆT HVILKEN,72,6dp70z,13,1495938415.0,,2017-05-28 04:26:55
Svensken er endelig kommet til fornuft,73,4tmi8i,14,1468979890.0,,2016-07-20 03:58:10
Geografi Nu! Har lavet en video om vore kære land!,72,4o7ztq,7,1466034862.0,,2016-06-16 01:54:22
Danske TSM vinder PGL season 1 LAN finalen.,72,3ngluu,4,1444002035.0,,2015-10-05 01:40:35
Hold den skide tysken ude,71,2vfu5x,4,1423620258.0,,2015-02-11 03:04:18
"Ser man bort fra Basims optræden, var det et smukt øjeblik da Dannebrog rullede ned",70,201d2y,6,1394475525.0,,2014-03-10 19:18:45
For folk og frihed!,75,1to8g5,10,1388009458.0,,2013-12-25 23:10:58
"NORSKEN OVERVEJER AT REGISTRERE ØLKØB, SVENSKEN HAR FOR LÆNGST LAGT SIG PÅ RYGGEN. DANMARK LÆNGE LEVE OG SKÅÅÅÅL!",69,1gpooe,2,1371739043.0,,2013-06-20 16:37:23
Kong Henrik er verdens største fugleven,73,1cgcsf,7,1366137841.0,,2013-04-16 20:44:01
SÅ ER DER DØMT KRIG MOD SVENSKEN,69,1c341k,3,1365654005.0,,2013-04-11 06:20:05
Snak sammen to og to om hvad der er uhyggeligt.,69,8375km,4,1520635430.0,,2018-03-09 23:43:50
Profit?,68,7uulka,12,1517634946.0,,2018-02-03 06:15:46
Professoren er på DANMAGs side!!,71,4hp4ku,2,1462329479.0,,2016-05-04 04:37:59
Vores stolte historie fortalt på imgur:,70,38taqw,10,1433639192.0,,2015-06-07 03:06:32
Netto er gået over til fjenden,71,2fq8r0,24,1410136693.0,,2014-09-08 02:38:13
Mit nyeste projekt!,70,2dsgh8,3,1408298295.0,,2014-08-17 19:58:15
"Valdemar Atterdag brandskatter Visby - et maleri der viser den danske konge holde en Svensk by til fange, efter at have nedslagtet enhver form for modstand. Malet af en Svensker, for selv Svensken ved at Danerne er de bedste.",73,27v3zy,2,1402507294.0,,2014-06-11 19:21:34
IKKE ENGANG BING VIL KENDES VED DEN VEDERSTYGGELIGE SVENSKE TALE,73,1ot2pn,1,1382256739.0,,2013-10-20 10:12:19
Det danske flag er stort og tydeligt. Svenskens er ugenkendeligt og flyder ud i Østersøen,72,1mftr2,7,1379291766.0,,2013-09-16 02:36:06
Cadeaux fra barndommens ven.,74,3vbw6s,10,1449206329.0,,2015-12-04 06:18:49
Endnu en dansker med i Game of Thrones. Endnu engang er svensken betragtet som for talentløs.,73,3jbpnk,0,1441204564.0,,2015-09-02 16:36:04
Lad ej Dannebrog svaje i den ekstremistiske ørkenvind. Vores tanker går til den dræbes familie og venner.,68,2vwei7,23,1423971385.0,"Hold en sober tone, tak.",2015-02-15 04:36:25
