title,score,id,comms_num,created,body,timestamp
Oppstem dette bildet for å kollektivt le av svensken!,680,7wd8uo,3,1518209749.0,,2018-02-09 21:55:49
DANSK GULD PÅ R/SHITTYAMA,459,1vo2lb,7,1390251274.0,,2014-01-20 21:54:34
KLIK IKKE! [NSFL],389,3leuhr,26,1442597335.0,,2015-09-18 19:28:55
Sweden. swedish flag. lad os overtage sverige med at overtage deres søgeresultater Hjælp kærer danskere med alle upvotes der er brug for!,394,5bt14b,7,1478638595.0,,2016-11-08 21:56:35
Skåne_IRL,377,6zu7dl,9,1505334535.0,,2017-09-13 22:28:55
Sammen står Dansken stærk,348,7etbot,8,1511405963.0,,2017-11-23 03:59:23
"Skåne. Scania. Skåne län. Opstem det smukke flag så folk kan se det, når de søger på skåne!",345,5dili3,14,1479448300.0,,2016-11-18 06:51:40
Vores allesammens Kronprins Frederik!,317,2cevxx,13,1407000794.0,,2014-08-02 19:33:14
Vila i frid prins Henrik. Länge leve Danmark och kärleken mellan våra länder!,311,7xgjiu,13,1518624260.0,,2018-02-14 17:04:20
DANMARK VINDER!!! UPVOTE PARTY!!! DU FÅR ET UPVOTE! DU FÅR ET UPVOTE! ALLE FÅR UPVORTES,301,1ell5g,76,1368944605.0,,2013-05-19 08:23:25
Hei fra oss i nord.,294,4d0wh9,10,1459618225.0,,2016-04-02 19:30:25
"Fear not my Danish friends, the Dutch are here to support you during the invasion!",286,2vo9hq,27,1423793018.0,,2015-02-13 03:03:38
Flag,267,5w3ol3,15,1488050928.0,,2017-02-25 20:28:48
"Efter angrebet i Sverige, vil jeg sige at det er enhver Danskers pligt at stå bag vores brødre i Sverige. Selvom de kan være irriterende",265,642oon,15,1491623261.0,,2017-04-08 05:47:41
To all you non-danes trying to invade this subreddit,258,2vo42w,8,1423790434.0,,2015-02-13 02:20:34
Inside the Danish börk industry,254,76x5e1,7,1508256716.0,,2017-10-17 18:11:56
"Sandheden er at finde på 4chan, viser det sig.",246,6kz2jt,2,1499105735.0,,2017-07-03 20:15:35
Make England Danish Again.,238,7ox4s5,11,1515427781.0,,2018-01-08 17:09:41
DET STØRSTE VIKINGETOGT TIL ENGLAND I 1000 ÅR. VI PLYNDREDE DERES HUSE OG VOLDTOG DERES KVINDER,242,1w44zo,24,1390686877.0,,2014-01-25 22:54:37
Dat ass.,240,2djvtk,8,1408062956.0,,2014-08-15 02:35:56
Krigsförklaring mot konungariket Danmag!!!,235,1c2itb,29,1365638718.0,"###Krigsförklaring mot konungariket Danmag


This is a declaration of war against the /r/danmag from /r/swarje. Surrender at once and admit Swärjes superiority over danmag or prepare for war. It is upp to you, the people of /r/danmag to decide what action to take:


Upvote this post accept the return of an age old tradition of all out war betwen /r/Swarje and /r/danmag

Downvote this post to accept that you are a nation of sillmjölkar and your country is far inferior to the great Konungarike Swärje


You have until ~~20:00~~ 21:00 this evening, at that time, the votes will be counted. If there are more downvotes then upvotes then you will be spared thän Swänska vreden and forever be fegisar in our eyse. But if the upvotes are more then the downvotes, then this will be a blood-drenched night full of crying warhorns and thundering cannon.



Rules of Engagement:

>Geneva protocol of internet warfare Article 1: War should be fought with clever image macros, wicked comments and upvotes on friendly troops.

>Geneva protocol of internet warfare Article 2: Downvoting enemy soldiers is not forbidden, but it is a practice only cowards takes part in.

>Geneva protocol of internet warfare Article 3: All kinds of spam, bots and other automatic and/or mindless warfare is strictly forbidden.


The war will wage on untill one or the other side declares itself defeated.",2013-04-11 02:05:18
"OL GULD TIL DANMARK, SVENSKEN IKKE I SYNE",232,4ywasr,18,1471833019.0,GODT GÅET DRENGE!,2016-08-22 04:30:19
FY FOR SATAN!,231,5l4epa,1,1483145686.0,,2016-12-31 01:54:46
Denne mand fylder 82 år i dag. 1 upvote = 1 tillykke!,230,4nlgir,7,1465681870.0,,2016-06-11 23:51:10
"Kære landsmænd. Jeg begynder at tro, at svensken alligevel er god nok.",226,30zsmm,10,1427877378.0,APRILSNAR! Glædelig første april.,2015-04-01 10:36:18
Alle gode ting kan bringes tilbage,226,7e9jjr,7,1511219988.0,,2017-11-21 00:19:48
STOLT DANSK JOURNALIST SENDER AMERIKANSKE KOLLEGAER TIL TÆLLING!,216,2nd1j3,5,1416942389.0,,2014-11-25 20:06:29
Det er svært at have et retarderet familliemedlem,211,68lpxp,1,1493671221.0,,2017-05-01 22:40:21
Ord ikke nødvendige,204,2a1xmc,11,1404774509.0,,2014-07-08 01:08:29
Når man vælger at flyve til Norge i stedet for at køre,201,5nklyj,8,1484270423.0,,2017-01-13 02:20:23
Når jeg er på /r/SWARJE...,205,1jf1n2,6,1375303677.0,,2013-07-31 22:47:57
"God. Gud. Allah. Opstem det smukke flag så folk kan se det, når de søger på gud!",200,5dmttb,10,1479510182.0,,2016-11-19 00:03:02
DET ENDELIGE OPGØR!,201,3srvr7,13,1447532227.0,,2015-11-14 21:17:07
Når selv svenskens babyer er på danskens side!,199,6f2vx3,8,1496545459.0,,2017-06-04 05:04:19
DANSK GULD PÅ /r/polandball. HVOR ER SVENSKEN?,197,30lll9,17,1427580541.0,,2015-03-28 23:09:01
ENHVER DANSKERS DRØM!,197,2oerv1,7,1417850048.0,,2014-12-06 08:14:08
JEG ER FOLKETINGET,195,89b02b,6,1522768191.0,,2018-04-03 17:09:51
Ｐｏｌｉｔｉｓｋ ｍｉｇｍｉｇ,195,8m0ot6,9,1527272705.0,,2018-05-25 20:25:05
Hele Norden er enig! Sverige = Skidt,186,6aajhh,8,1494417746.0,,2017-05-10 14:02:26
Et gammelt H.C. Andersen citat,183,1c0k7f,9,1365569859.0,,2013-04-10 06:57:39
Danmag i en nøddeskal,185,26w1uv,8,1401499615.0,,2014-05-31 03:26:55
Da jeg var i Legoland fixede jeg lige hvad en tysker havde lavet på gæstevæggen.,176,4oifgd,7,1466184307.0,,2016-06-17 19:25:07
DANMAG_ivirkeligheden,176,63gv8j,8,1491367214.0,,2017-04-05 06:40:14
At rejse er at leve!,176,349kcj,3,1430336241.0,,2015-04-29 21:37:21
"Her ser vi en ægte nordisk gud, ingen hollywood dukker kan klare den ægte vare!",172,1xgqye,4,1392011964.0,,2014-02-10 06:59:24
utilgiveligt,171,6fvf6r,7,1496889617.0,,2017-06-08 04:40:17
"<---- Procent Svenskere der ikke kan stave til ""Danskjåvel""",171,2qm0vh,8,1419795112.0,,2014-12-28 20:31:52
"DANSK CSGO HOLD ASTRALIS VINDER E-LEAGUE MAJOR, SVENSKEN UDE I SEMIFINALEN",170,5qvlrc,13,1485747388.0,,2017-01-30 04:36:28
SOV GODT SVENSKERE! DANMAG',167,1d12ln,6,1366860559.0,,2013-04-25 05:29:19
Reddit officielle blog hylder dansk hygge,166,2leqyq,16,1415253272.0,,2014-11-06 06:54:32
"Dansk-Norsk propagandaplakat fra den anden Store Nordiske krig (2019, farvelagt)",164,8lic71,8,1527100796.0,,2018-05-23 20:39:56
Vi kan alle lære noget af reglerne for brug af Lukas Grahams musik på Youtube,166,6vu6i5,0,1503640428.0,,2017-08-25 07:53:48
Hvor mange op-bobs kan vores dansk producerede Tesla få?,165,8bhh3m,12,1523485676.0,,2018-04-12 00:27:56
Typisk svensker på udflugt med kæresten.,164,4ijo87,4,1462831375.0,,2016-05-10 00:02:55
Gjeninnfør Danmark-Norge! Aldri mer skal vi høre på svenskens evige arroganse.,159,8ekd4h,26,1524605090.0,,2018-04-24 23:24:50
DANMARK INDTAGER FORSIDEN!,162,1ebbol,23,1368569187.0,,2013-05-15 00:06:27
Google har sjældent været kønnere!,159,6fbqkd,2,1496661655.0,,2017-06-05 13:20:55
Dansk produktudvikling (NSFW),155,3eb7zq,13,1437679409.0,,2015-07-23 21:23:29
"Spiller en smule Battlefield og får det her skrald, hvad fanden tager de mig for?",157,5eoexc,10,1480032420.0,,2016-11-25 01:07:00
Danmark fixer Sverige,154,8fz2y1,6,1525120259.0,,2018-04-30 22:30:59
Når Bismarck rør ved dine hertugdømmer...,158,7wkvfq,6,1518289672.0,,2018-02-10 20:07:52
🇩🇰>🇸🇪,150,76d3st,7,1508027305.0,,2017-10-15 02:28:25
Nordmennene og danskene er i det minste enig om én ting...,153,2brruh,15,1406399852.0,,2014-07-26 20:37:32
>den følelse når man er dansker,149,4ttduh,18,1469077712.0,,2016-07-21 07:08:32
DE NAIVE SVENSKERE TROR DE HAR LØST PROBLEMET MED KRIMINALITET,152,2zy1a0,6,1427089746.0,,2015-03-23 06:49:06
Danmark er ældst af de nordiske lande!,150,7ze5ed,10,1519326581.0,,2018-02-22 20:09:41
DANMAGS KONGE AF KØKKENHAVER!,152,1kh2n7,2,1376663300.0,,2013-08-16 16:28:20
"Ingen vil NOGENSINDE kunne tage tronen fra Dannebrog, verdens ældste nationalflag. De andre lande når os ikke til sokkeholderne!",151,4c4o7t,9,1459088017.0,,2016-03-27 16:13:37
Er det?,151,8q06hf,14,1528658381.0,,2018-06-10 21:19:41
Me2irl4lockout,148,83pxw7,0,1520833980.0,,2018-03-12 06:53:00
Så dette guldkorn i Futurama og tillod mig at tilføje lidt,148,1ci1zk,8,1366189188.0,,2013-04-17 10:59:48
De har travlt med at spille dota så jeg har lige sendt vores tungeste skyts over Øresund,146,1c4itf,6,1365700657.0,,2013-04-11 19:17:37
Norsken har nogle fine traditioner,147,78u73s,5,1509035049.0,,2017-10-26 18:24:09
Dansk højkultur,148,5niir2,3,1484243196.0,,2017-01-12 18:46:36
Denmark overtakes Switzerland and regains title of 'world's happiest country',149,4anj3n,12,1458159533.0,,2016-03-16 21:18:53
Elsk hende. Frygt hende.,147,8malyl,3,1527374890.0,,2018-05-27 00:48:10
Tyvstjålet men prisværdigt migmig,142,86f5mg,5,1521782126.0,,2018-03-23 06:15:26
Kort over Østukraine til alle russiske soldater i området,144,6qo3y0,2,1501533147.0,,2017-07-31 22:32:27
Hurra for Helten Københavns Zoo har brug for og fortjener!!,145,1xn058,7,1392176591.0,,2014-02-12 04:43:11
DRONNING MARGRETHE OG B.S GÅR MED I KAMPEN MOD SVENSKEN!,145,1v837t,5,1389765867.0,,2014-01-15 07:04:27
GRUNDLOVEN FYLDER 165 ÅR! LÆNGE LEVE DANSK DEMOKRATI OG GLÆDELIG GRUNDLOVSDAG LANDSMÆND!,141,27d1p4,5,1401977524.0,,2014-06-05 16:12:04
Det smukkeste jeg har set hele dagen.,146,1z2v7z,20,1393530613.0,,2014-02-27 20:50:13
Den rigtige nordiske gud,141,9so2ql,4,1540936307.0,,2018-10-30 22:51:47
Nul udenomssnak hos Danbolig Horsens,139,7w18o3,1,1518082225.0,,2018-02-08 10:30:25
Kåre er god,139,7535n9,4,1507513474.0,,2017-10-09 03:44:34
DANMARK AFSLUTTER MED EM GULD FOR NÆSEN AF SVERIGE OG SÆTTER NY REKORD...HÆVNEN ER SØD!,140,2egcgc,7,1408927214.0,,2014-08-25 02:40:14
Kaj har fået 12 i fugtige migmiger,139,8tzlp5,10,1530044922.0,,2018-06-26 22:28:42
Dette niveau af migmig-teknologi begriber svensken overhovedet ikke.,141,7u90i6,3,1517423548.0,,2018-01-31 19:32:28
En sand udfordring for svensken,139,3c0tbd,5,1435978518.0,,2015-07-04 04:55:18
INTRO TIL DANMARK!,139,2qn57r,27,1419826855.0,,2014-12-29 05:20:55
Hundene er gået ind i kampen!,137,1c5wcf,12,1365745587.0,,2013-04-12 07:46:27
Konkret bud på Sveriges nye flag? (nsfw),137,4dx197,1,1460160004.0,,2016-04-09 02:00:04
pas på ved man støder ind i,136,5tovl9,2,1486967610.0,,2017-02-13 07:33:30
"Svensken tror de er gode, men i deres eget eksempel taber de til Danmark",134,5r98hw,9,1485909418.0,,2017-02-01 01:36:58
DANMARK VINDER AF DET EUROPÆISKE MELODI GRAND PRIX,133,1ell5u,6,1368944618.0,,2013-05-19 08:23:38
"Hvad fanden sagde du lige om mit land, din skide svensker?",134,4f3inp,6,1460866484.0,,2016-04-17 06:14:44
Mit røde hjerte banker for mine røde landsmænd!,136,1ktl71,2,1377140182.0,,2013-08-22 04:56:22
Europa jubler over Grundlovsdag mens svensken må nøjes med en andenplads,134,8pcp98,2,1528424736.0,,2018-06-08 04:25:36
Estland vs Dannebrog,131,6e8qwx,6,1496193634.0,,2017-05-31 03:20:34
Hvad siger i /r/DANMAG? Er det noget I kan bruge?,127,1dm8je,22,1367616522.0,,2013-05-03 23:28:42
BESKU VERDENS ÆLDSTE FLAG,128,1bzj7b,17,1365541702.0,,2013-04-09 23:08:22
Sverige har åbnet verdens største museum,127,6jzj8o,6,1498671811.0,,2017-06-28 19:43:31
Fandt dette stykke poesi efterladt på et hostle i Australien,129,23cfe7,3,1397842771.0,,2014-04-18 19:39:31
"Dear Danish brethren, the Swedes have insulted both of our flags and languages. Will you reform our alliance and come to war with us? -Your Dutch friends",127,8fbq8u,17,1524865336.0,,2018-04-27 23:42:16
"We don't say ""I like love you"" in Denmark, we say ""Jeg vil brænde svensken med dig"", which roughly translates to ""I trust you like I trust my country"" and I think that is beautiful.",130,6o9ivn,7,1500509697.0,,2017-07-20 02:14:57
"ADVARSEL: DENNE COMIC INDEHOLDER SVENSKEN (Bare roligt, som om det skulle være en overraskelse er der intet godt om dem i den)",132,5kz0he,2,1483071822.0,,2016-12-30 05:23:42
På resturant i Spanien!,130,2bak4a,18,1405977943.0,,2014-07-21 23:25:43
"Jeg er i gang med et ""Danmag"" mod til spillet Civilization V. Her er en lille smagsprøve.",126,22dd6m,14,1396846553.0,,2014-04-07 06:55:53
svensken har brug for seriøs hjælp.,129,71tr2t,10,1506140975.0,,2017-09-23 06:29:35
DANSK R/MADPORNOGRAFI,127,3irbni,12,1440816657.0,,2015-08-29 04:50:57
Et tastatur jeg kan leve med,121,5rzy8a,7,1486234018.0,,2017-02-04 19:46:58
Intet mindre end et smukt billede,126,1kvq7m,11,1377216235.0,,2013-08-23 02:03:55
Nyt dansk krigsmateriel afprøves i Helmand,128,1doa9g,5,1367696912.0,,2013-05-04 21:48:32
HVORFOR BLEV JESUS IKKE FØDT I SVERIGE?!?!?!???!!!,128,2gvotq,12,1411177791.0,De kunne hverken finde tre vise mænd eller en jomfru...,2014-09-20 03:49:51
Det danske overtag er fuldendt! LÆNGE LEVE VORT STOLTE KONGERIGE!,125,1wkw4m,6,1391138919.0,,2014-01-31 04:28:39
Selv Vsovs hader svensken,125,6qx90w,9,1501632643.0,,2017-08-02 02:10:43
Glædelig Grundlovsdag,122,8oob0l,0,1528205471.0,,2018-06-05 15:31:11
Danmark stjæler OL guld i håndbold for øjnene af franskmændene! Svensken kan ikke engang gribe en bold!,123,4ywb6x,5,1471833145.0,,2016-08-22 04:32:25
Svenskerskak.,122,2v7p2w,6,1423449560.0,,2015-02-09 03:39:20
Gud bevare,120,720c0a,1,1506223568.0,,2017-09-24 05:26:08
Lige nu til verdens største e-sport event. HVOR ER SVENSKEN?! x-post r/denmark,117,6t37kv,5,1502505816.0,,2017-08-12 04:43:36
Jeg lavede en ting,118,3kk60t,12,1442017949.0,,2015-09-12 02:32:29
Bedre udsigt findes ikke! - En herlig start på dagen.,123,27jhjo,8,1402166453.0,,2014-06-07 20:40:53
LANDSFORRÆDERI I GO'MORGEN DANMARK!!!,123,250p8e,13,1399555381.0,,2014-05-08 15:23:01
Ad forfanden!,123,25x9jz,0,1400511140.0,,2014-05-19 16:52:20
VI BURDE ANGRIBE DE LEDE NIDDINGER I /R/SHITTYAMA FOR IKKE AT TILLADE DANSKERE! DETTE ER SÅ FORRÆDERISK AT SVANERNE GRÆDER!,122,1vmj3c,14,1390201321.0,,2014-01-20 08:02:01
FUT FUT ALLE OMBORD!,122,1bzu4v,7,1365551663.0,,2013-04-10 01:54:23
Norsken staver sig selv til grin,117,2xnubs,13,1425327616.0,,2015-03-02 21:20:16
1848 > 1864,118,9hhghk,2,1537495300.0,,2018-09-21 04:01:40
Set på Frederiksberg,116,6z0kao,2,1504972828.0,,2017-09-09 18:00:28
Dannebrog får tusindvis af upvotes. Det overrasker selvfølgelig ingen!,119,5lrn6w,8,1483474842.0,,2017-01-03 21:20:42
Skammemaskinen,114,8zdqha,5,1531796640.0,,2018-07-17 05:04:00
"Fandens nordmænd kom på front page med deres wannabe risengrød! Satans nassere, først vil de være uafhængige, men nu stjæler de fandme en af vores mest elskede nationalretter?! Jeg er helt målløs!",116,5gigcd,14,1480922633.0,,2016-12-05 08:23:53
"En ting må man give svenskerne, de har en bedre udsigt. NEMLIG TIL DANMARK",114,3ugq5k,6,1448659849.0,,2015-11-27 22:30:49
Sommer,116,2s9k4d,3,1421169009.0,,2015-01-13 18:10:09
"Hov, Bendtner er da nok lige den bedste i verden, hva? Svensken ved slet ikke hvad der sker",118,2hb3a4,8,1411569094.0,,2014-09-24 16:31:34
DANSKEHEDEN SAMLET PÅ KANALRUNDFART!,115,1uvy54,11,1389397572.0,,2014-01-11 00:46:12
Svensken som det eneste land i Europa der har en knoldesparker som leder,115,7eyjef,13,1511458522.0,,2017-11-23 18:35:22
Til helvete med sverige. (Rant),116,763znz,23,1507920490.0,"Hei. 

Nordmann her, som har sett seg utrolig fucking lei av arrogante og uvitende svensker. De tror at Norge hadde vært et sisteklasses U-land uten oljen (ikke faktabasert i det hele tatt; Norge hadde en av verdens største handelsflåter ved starten av WW1, bare toppet av japan, usa og england mm.) 

De anklager både Danmark og Norge for å være rasister for å simpelthen heise flaggene våre og være stolte av våre land. De ansetter uhorvelige mennesker som Martin Aagård.^1

https://www.expressen.se/debatt/vi-morka-kan-aldrig-bli-riktiga-norrman/

https://www.flashback.org/t1476391

https://www.rights.no/2014/09/vi-er-ju-tross-alt-inte-norge/

https://www.aftonbladet.se/kultur/article16089195.ab ^1

Mange av mine landsmenn vil si at Sverige var en bedre unionspartner grunnet større norsk selvstendighet, men det som skjer nå gjør MER enn opp for den såkalte ""400års-natten"" (https://no.wikipedia.org/wiki/400-%C3%A5rsnatten) vi hadde med dere. 

Fuck Sverige. Danmark respekterer oss, og vi respekterer Danmark: det samme kan desverre(?) ikke bli sagt for Norge-Sverige. Kall meg gjerne militant, men jeg er så JÆVLIG lei av å ikke bli tatt seriøst av svensker.

La oss bygge opp igjen vårt gamle samarbeid, uten at vår uavhengighet går til grunne denne gangen. ;\)

Mvh Nordmann.",2017-10-13 20:48:10
Ordbogen har fat i noget,116,5iuihy,3,1482011078.0,,2016-12-17 22:44:38
TSM TAGER SKRALDET UD,115,33xli6,14,1430095442.0,,2015-04-27 02:44:02
Mig_idvl,116,748uu1,2,1507159504.0,,2017-10-05 01:25:04
We will rebuild!,116,1pe254,17,1383002619.0,,2013-10-29 00:23:39
Så sandt som det er sagt,117,40eisg,6,1452506386.0,,2016-01-11 10:59:46
Fantastisk Polandball tegneserie.,114,2lyy8p,11,1415747445.0,,2014-11-12 00:10:45
Hvorfor leger svensken ikke gemmeleg?,115,1da9rc,5,1367203186.0,####Fordi ingen gider at finde dem,2013-04-29 04:39:46
Svensken er jo skrald!,108,5mnkhl,8,1483860217.0,,2017-01-08 08:23:37
"Takk til de Bacon, Danmark! Fra dine bedte ven, England!",109,1w6yvs,27,1390774647.0,,2014-01-26 23:17:27
Den store og mægtige Laudrup viser sin dominans,110,2ruu3m,0,1420840403.0,,2015-01-09 22:53:23
Sverige er et tredjeverdensland!,110,8nk2mv,7,1527814861.0,,2018-06-01 03:01:01
As an american facinated by r/SWARJE/ and r/DANMAG I made a website showing my feelings about the r/all war going on,108,7bf9si,17,1510109318.0,,2017-11-08 03:48:38
"En drøm, vi alle drømmer!",109,39fpb4,13,1434054201.0,,2015-06-11 22:23:21
Mænd i Sverige,108,2uzvdo,7,1423268400.0,,2015-02-07 01:20:00
De engelske imperialister forstætter angrebet. Dette kræver tungere skyts! Bøfsandwich!,108,1w3vpp,8,1390673604.0,,2014-01-25 19:13:24
"Et sjovt ""find ordet"" spil for hele familien!",109,6vkg30,4,1503537383.0,,2017-08-24 03:16:23
Den ultimative bjergbestiger-bedrift,112,3j5p7p,5,1441097692.0,,2015-09-01 10:54:52
"I en tid med skuddramaer og importeret Valentinsoverload er det vist på tide at minde hinanden om, hvad dansk februar er for en størrelse.",110,2vxaae,6,1423988187.0,,2015-02-15 09:16:27
"Danmarks historie hyldes endnu engang på forsiden, svensken nævnes slet ikke.",113,2twyu3,17,1422439859.0,,2015-01-28 11:10:59
Terrorist løs i DK!!,113,2g34fr,8,1410451815.0,,2014-09-11 18:10:15
FORSVARSVÆRKERNE ER PÅ PLADS,106,1c2xom,3,1365649546.0,,2013-04-11 05:05:46
Mage til dårlig smag har jeg næppe set,110,87brzy,3,1522120260.0,,2018-03-27 05:11:00
Søslaget i Køge Bugt 1677,106,2wvhvb,9,1424731947.0,,2015-02-23 23:52:27
Pepe som stolt daner,109,51q615,2,1473348999.0,,2016-09-08 17:36:39
DANMARKS NATIONALRET ER FUNDET!,109,2muzyu,9,1416501233.0,,2014-11-20 17:33:53
De svenske specialstyrker melder sig i kampen,103,1c72n4,8,1365785483.0,,2013-04-12 18:51:23
En hund bliver tilbudt svenskens nationalspise,105,52vs3n,11,1473969392.0,,2016-09-15 21:56:32
Brødre! Vi må ikke lade den tysk-svenske alliance bringe os ned! Vi ruller bare endnu større kanoner ud: H.C. ANDERSEN!,108,2vk233,4,1423705749.0,,2015-02-12 02:49:09
Den endelige løsning,106,26ifxb,9,1401128102.0,,2014-05-26 20:15:02
Endnu en gang står Dannebrog stolt,110,21t5i6,4,1396275384.0,,2014-03-31 16:16:24
"åh-åh, Swarje; her kommer et par tons dansk frihed!",106,1dig60,1,1367476591.0,,2013-05-02 08:36:31
Berlingske kommer med en super pointe til sidst!,104,6yiqek,0,1504762782.0,,2017-09-07 07:39:42
"God eftermiddag til jer alle, udover personen som er ansvarlig for dette.",107,6l6tmi,20,1499200747.0,,2017-07-04 22:39:07
DANSKEN VINDER OVER SVENSKEN,102,5odiup,10,1484630001.0,!!!!!!!27-25!!!!!!!,2017-01-17 06:13:21
Jeg blev tilbudt et job i Sverige i dag,107,3wyhkq,14,1450226529.0,Jeg afslog,2015-12-16 01:42:09
"Svensken til venstre, kongeriget til højre.",103,2lkzdh,9,1415400578.0,,2014-11-07 23:49:38
PRØVER SVENSKEN OVERHOVEDET?,105,1bqtm5,0,1365211404.0,,2013-04-06 03:23:24
Jeg savner lidt Kaj memes...,107,6wbf95,1,1503856744.0,,2017-08-27 19:59:04
Forslag til Sveriges nye flag,103,46mxcm,11,1455946257.0,,2016-02-20 06:30:57
Svenskerne er nu ret hippe,108,3ytubr,6,1451537768.0,,2015-12-31 05:56:08
Danmark har en dansk Kermit! Men hvad har svensken?!,104,5kjhiy,9,1482870167.0,,2016-12-27 21:22:47
"I forbindelse med det kolde vejr udenfor, bringer jeg et varmende billede <3",102,3ttqax,14,1448238623.0,,2015-11-23 01:30:23
Sandheden om svensken,105,2y4hsr,8,1425666294.0,,2015-03-06 19:24:54
Nationalret!,101,2veb1c,6,1423582567.0,,2015-02-10 16:36:07
Briliant Sweden.. really,106,2egvcp,2,1408939589.0,,2014-08-25 06:06:29
Swarje forstår sig ikke på bannere.,106,1er5x8,22,1369155479.0,,2013-05-21 18:57:59
VI KAN VÆRE STOLTE AF AT DENNE TRIO HAR BRAGT OS GOD UNDERHOLDNING I OVER 40 ÅR!,104,1cabav,9,1365912786.0,,2013-04-14 06:13:06
Tysken er så småt ved at blive et civiliseret folkefærd,103,4bkpdd,7,1458728729.0,,2016-03-23 11:25:29
ET RIGTIGT JULETRÆ,102,3xomst,5,1450718032.0,,2015-12-21 18:13:52
The Prinsgemal Awakens... Fra sin lur (x-post /r/denmark),103,3x7srw,3,1450390677.0,,2015-12-17 23:17:57
Kom igen Sverige!,100,1p42i7,12,1382633154.0,,2013-10-24 18:45:54
NED MED SVENSKEN!,104,736d35,8,1506699615.0,,2017-09-29 17:40:15
Den danske nation dominerende ved OL - Svensken dominerer knap nok sig selv.,102,4xuuba,0,1471312336.0,,2016-08-16 03:52:16
Royal raincoat,98,6nmyvd,6,1500250284.0,,2017-07-17 02:11:24
"HOLGER DANSKE SPOTTET I FOR HONOR, MEN HVOR ER SVENSKEN??",101,5t8x3n,6,1486779510.0,,2017-02-11 03:18:30
"Svensk er så dårligt et sprog, selv Svensken har problemer med det.",99,4i1px7,7,1462507775.0,,2016-05-06 06:09:35
De kan ikke være det bekendt!,99,3p92jf,3,1445220206.0,,2015-10-19 04:03:26
Svensken kan ikke engang give tegneseriekatte de korrekte navne,96,2g7na1,9,1410567845.0,,2014-09-13 02:24:05
DANMARK AFVISER RUSSISK FLYANGREB PÅ SVERIGE NÅR NU SVENSKEN IKKE MAGTER DET,97,1cusbs,11,1366652302.0,,2013-04-22 19:38:22
SKAL JEG SKÆRE DET UD I PAP?,98,1bx57w,6,1365462093.0,,2013-04-09 01:01:33
Forskere pr. million mennesker - Danmag er vinderen (fundet i r/MapPorn),96,713wc3,11,1505865227.0,,2017-09-20 01:53:47
To ting der går hånd i hånd,100,6o0hyq,0,1500410417.0,,2017-07-18 22:40:17
EUROPE UNDER EN VIRKELIG LEADER!,100,69ola2,12,1494146582.0,,2017-05-07 10:43:02
Nok sagt,99,3sn48q,8,1447431958.0,,2015-11-13 17:25:58
OPDATERING: Nu er de britiske kolonier også faldet for den musikalske overmagt!,99,3qdxqo,7,1445954686.0,,2015-10-27 15:04:46
"Kan vi lige bruge et øjeblik på at anerkende det her fucking seje billede?! Hvis det ikke er dansk viking feat. breaking bad feat. videnskabsgeni, så ved jeg ikke hvad er.",100,31nlov,4,1428373848.0,,2015-04-07 04:30:48
"Hvor er jeres Vikingeguder nu, Svensken?",102,2g38at,10,1410456406.0,,2014-09-11 19:26:46
Jesper Steinmetz sender verdens bedste land direkte til forsiden med sin cool stil,95,2bxyay,5,1406583341.0,,2014-07-28 23:35:41
"Landsmænd, hold inde! /r/shittyama er jo fuldstændigt udplyndret! Der finder vi ej mere bytte!",101,1vqzht,35,1390322324.0,"Vi må søge efter ny kyster at hærge. Jeg stemmer for vi organiserer en dag hvor vi indtager en af standard-subs'ene med indhold af høj kvalitet, f.eks. /r/pics med billeder af vort stolte fædrendeland.

Edit: Der er stemning for et angreb på /r/inglin. Hvis det skal gøres, skal vi gøre det ordentligt; det er den danske måde. For at låne fra det stolte Danske Forsvar, så skal det være VOVS: Velovervejet, Overvældende, Voldsomt og Samtidigt.

Alle plyndringsivrige vikinger opfordres til at samle sig våben til togtet. Det bør være 'rigtige' posts, altså ikke bare spam af ""Argh, viking"", men ting som har en eller anden relation til angelsakserne, f.eks. TIL's om danegæld, danelov, Svend Tveskæg, Knud den Store (Wilhelm Erobreren måske, normannerne var trods alt bl.a. af dansk afstamning. Så kan nordmanden måske også være med), sportsresultater (fodboldkampe f.eks.), deres import/afhængighed af vores bacon, øl eller andre produkter.

Og, for at være rimelig (om noget en dansk dyd), må det også meget gerne være posts der stiller både angelsakseren *og* daneren i et godt lys, evt. samarbejder imellem de to stolte nationer.

Men det skal altså være indhold(! ikke dumme memes) som har en relation til angelsakserne *og* danerne og som rent formelt hører ind under /r/inglin 's regler. Jeg håber vi alle kan være enige om at det er en værdig måde at gøre tingene på.

Jeg forventer at vi kan iværksætte et angreb senest lørdag, men vi kan holde mandtal og mønstring af skytset lidt undervejs.",2014-01-21 17:38:44
SKIBET AF DANSK STOLTHED PÅ VERDENSOMREJSE (VI HAR VORES TOG MED FRA SPAGHETTIARMEN),102,1usdpr,13,1389291384.0,,2014-01-09 19:16:24
DET ALLERHELLIGSTE,96,1c9nvn,3,1365889822.0,,2013-04-13 23:50:22
Original migmig,96,9obhya,1,1539628364.0,,2018-10-15 20:32:44
Flaget på halv! Danmags nationalskjald er gået bort!,100,9k59vj,8,1538331238.0,,2018-09-30 20:13:58
Hvor er svensken?,98,5xi6kt,11,1488679529.0,,2017-03-05 03:05:29
TIL svensken har lavet en bog med 501 beskrivelser af Øresundsbroen,99,3gcbv2,3,1439149710.0,,2015-08-09 21:48:30
STOLT DANSK HUMOR,98,3g5h5j,11,1438997809.0,,2015-08-08 03:36:49
Hvordan en god filmoplevelse ødelægges lige fra starten af,99,359tgq,2,1431103660.0,,2015-05-08 18:47:40
"Endelig sagde de noget klogt på ""Welcome to Sweden""",98,2pb41m,7,1418631468.0,,2014-12-15 09:17:48
"3 danske film er nomineret til en Oscar! Jagten, The Act of Killing go Helium! Men hvor er svensken? DE ER SLET IKKE NOMINERET!",99,1vd27m,0,1389911269.0,,2014-01-16 23:27:49
"Manden bag programmeringssproget C++, en ægte dansk viking!",98,1fproz,15,1370461457.0,,2013-06-05 21:44:17
165.000 TONS REN DANSK VERDENSHERREDØMME,97,1bzwbh,2,1365553176.0,,2013-04-10 02:19:36
